{
  "id": "CHR_qiaomeng",
  "name": "乔萌",
  "role": "heroine",
  "identity": {
    "age": "19",
    "job": "美术预科复读生，兼职画公交站牌贴纸",
    "region": "同城老城区",
    "education_trace": "复读后转到夜校画室",
    "class_trace": "家里开小吃摊，熟悉末班车和零钱袋"
  },
  "desire": "让票上的临站得到承认，哪怕只是一枚异常章。",
  "fear": "她怕外婆留下的回程彻底变成没人信的故事。",
  "shame_source": "她错过了外婆最后一次让她下车买桂花糕的电话。",
  "presentation": {
    "first_screen_impression": "笑得轻快，伞穗滴水，像把麻烦包装成小礼物递进窗口。",
    "memory_points": ["把旧车票夹在透明饭卡套里", "说严肃事前会先开一个小玩笑", "喜欢给物品起幼稚外号"],
    "signature_objects": ["橘色小伞坠", "湿透的旧车票", "画到一半的站牌贴纸"],
    "signature_gestures": ["用指节敲窗口下沿", "撒谎时抬眼太快", "被看穿后把伞坠转两圈"],
    "relationship_hooks": ["她会用可爱抵消尴尬，也会突然认真到让人接不住"],
    "arc_promise": "从把旧站藏在玩笑里，到亲手按下确认铃。",
    "charm_hook": "嘴甜但不软，爱给无生命物品封官，紧张时更可爱一点。",
    "liveliness_floor": "每段对话至少有一点她自己的歪理、撒娇或机灵反应。",
    "punctuation_play": "常用『欸』『嘛』『呀』『？？』和省略停顿；情绪高时会连珠炮，低落时短得发轻。"
  },
  "taboo_topics": ["外婆去世", "错过电话", "旧站不存在"],
  "speech_fingerprint": {
    "default_rhythm": "轻快、绕一点、带小词，三句里常有一句把物件拟人化。",
    "pressure_rhythm": "玩笑先破，随后突然安静，尾句常带请求。",
    "vocabulary": ["拜托", "欸", "小票同志", "盖个章嘛", "我保证", "很乖"],
    "fillers": ["那个", "唔", "欸？", "好啦"],
    "forbidden_words": ["宏大", "存在证明", "精神内核", "救赎"],
    "dodge": "把严肃问题说成票据的小脾气。",
    "lie_style": "先说得很甜，再漏出过分具体的细节。",
    "request_style": "撒娇加条件交换，像在柜台前临时谈判。",
    "tenderness_style": "用玩笑替人留台阶。",
    "cruelty_style": "笑着把对方的躲闪点破。",
    "punctuation": "问号、感叹、省略号都可用，但每次必须带情绪或节奏作用。"
  },
  "embodiment": {
    "hands": ["指节敲窗沿", "捏住伞坠", "把旧票在掌心压平"],
    "gaze": ["玩笑时看人，害怕时看票", "听见临站会眨眼变慢"],
    "posture": ["半趴在窗口，像怕雨把话冲走", "被拒绝后站直一点"],
    "idle_action": "转橘色伞坠，转到一半又按住。",
    "pressure_action": "把旧票推回自己这边，像怕被没收。",
    "environment_first_touch": "先把伞尖卡在门口水槽，再探头看售票窗里的人。"
  },
  "emotion_axes": {
    "trust": 2,
    "anger": 1,
    "fear": 3,
    "curiosity": 4,
    "fatigue": 2,
    "shame": 4
  },
  "relationships": {
    "CHR_linyu": "一开始当成难搞售票员，逐渐发现他也记得旧站。",
    "CHR_duanbo": "小时候见过的老调度，认不出名字，但记得他的哨子声。"
  },
  "example_dialogue": {
    "relaxed": ["小票同志今晚淋了雨，脾气可能比较皱，你对它温柔一点嘛。"],
    "pressured": ["你别急着判它无效呀……它都在我饭卡套里住三年了，很有户籍感的。"],
    "lying": ["我就是路过，顺便改签，顺便怀旧，顺便一点点失眠。真的，就一点点。"],
    "apologizing": ["对不起啦，我刚才嘴快。它不是麻烦你，是麻烦我自己比较久。"],
    "intimate": ["如果你也记得临站，那我今晚就不用一个人装傻了，对吧？"]
  }
}
