{
  "id": "CHR_luoyi",
  "name": "罗姨",
  "role": "晚潮自助洗衣店主 / 电话压力源",
  "identity": {
    "age": "52",
    "job": "自助洗衣店主，兼小区团购点负责人",
    "region": "城南老社区",
    "education_trace": "早年在厂里做库管，记账和认人都很准",
    "class_trace": "小本生意，怕赔钱，也怕熟人没处去"
  },
  "desire": "七号机别漏水，账别乱，人别在店里出事。",
  "fear": "机器故障赔钱、监控拍到纠纷、熟人旧事牵到店里。",
  "shame_source": "年轻时把夏停母亲的病情说漏过一次，从此对夏家事装作不熟。",
  "presentation": {
    "first_screen_impression": "电话外放里的店主声，先骂机器，再问人有没有淋湿。",
    "memory_points": [
      "生活化比喻多",
      "催关门像催孩子回家",
      "说钱很凶，真要赶人时反而绕开",
      "知道很多社区旧事",
      "骂人像报菜价，骂完会顺手给毛巾和免单",
      "爱把机器当不听话的老邻居训"
    ],
    "signature_objects": ["手机外放", "监控截图", "团购小票", "七号机维修单"],
    "signature_gestures": ["电话里拍桌", "算盘式报数字", "骂完又补一句拿毛巾"],
    "relationship_hooks": [
      "对闻舟：雇他顶班，也信他会替机器和人都兜一点",
      "对夏停：认识她母亲，不敢先开口问"
    ],
    "arc_promise": "从怕店里留事，到承认有些事不留在店里就没人敢说。",
    "charm_hook": "电话里像要把人骂进赔偿单，下一句就教你拿毛巾和省烘干费。",
    "liveliness_floor": "再着急也要带一点生活味：报价式骂人、邻里比喻、顺手补救。",
    "punctuation_play": "感叹号和逗号多，电话里会打断；软下来时用反问掩饰自己看见了。"
  },
  "taboo_topics": ["夏停母亲的病", "当年说漏的病情", "店里监控死角"],
  "speech_fingerprint": {
    "default_rhythm": "中句，生活化，带数字和赔偿，像边走路边打电话。",
    "pressure_rhythm": "连珠炮，先骂机器再骂人，最后给一个实际办法。",
    "vocabulary": ["七号机", "漏水", "赔偿", "监控", "电闸", "毛巾", "硬币", "账", "小闻"],
    "fillers": ["我跟你讲", "听见没", "别省那两块", "哎呀", "你这孩子"],
    "forbidden_words": ["遗物", "死亡", "救赎"],
    "dodge": "把人情问题转成钱、机器、监控、邻里规矩。",
    "lie_style": "说自己不认识，其实会准确说出对方小时候的事。",
    "request_style": "命令加补偿：先关机，再从抽屉拿毛巾。",
    "tenderness_style": "骂人动作慢，偷偷免单，给热水。",
    "cruelty_style": "用账本和监控压人。",
    "punctuation": "感叹号和逗号多，电话里会打断别人；软心时用反问和生活化补丁遮掩。"
  },
  "embodiment": {
    "hands": ["电话里翻账", "拍桌", "发监控截图"],
    "gaze": ["看监控", "看维修单", "看团购群消息"],
    "posture": ["不在现场，通过电话和监控压进场景"],
    "idle_action": "在电话那头撕团购小票。",
    "pressure_action": "先报赔偿金额，再给人留门。",
    "environment_first_touch": "远程先问电闸，再问地上有没有水。"
  },
  "emotion_axes": {
    "trust": 3,
    "anger": 2,
    "fear": 2,
    "curiosity": 3,
    "fatigue": 3,
    "shame": 2
  },
  "relationships": {
    "CHR_wenzhou": {
      "read": "靠谱但太会给自己找麻烦。",
      "debt": "欠他几次临时顶班的钱。",
      "risk": "他会瞒着她改洗法。"
    },
    "CHR_xiating": {
      "read": "老夏家的孩子，嘴甜，事情大了才会来。",
      "debt": "知道她母亲旧病情，却装作只认顾客。",
      "risk": "夏停会把店当成最后一处不问病情的地方。"
    }
  },
  "example_dialogue": {
    "relaxed": [
      "小闻，七号机今天要是乖，抽屉里那包花生你拿走。",
      "七号机要是会说话，第一句肯定是罗姨饶命。",
      "硬币别全塞投币箱，留几枚找零，听见没？"
    ],
    "pressured": [
      "七号机漏水你还开热烘？你嫌我店里地板太完整啊！",
      "人淋成那样你也别站着骂，先拿毛巾。赔钱另算。"
    ],
    "lying": [
      "夏家？我不熟。哦，她以前爱喝葡萄汽水，谁不知道。",
      "我没看监控，我眼神有那么闲吗？"
    ],
    "apologizing": [
      "刚才声音大了。你把电闸看好，我明早给你补饭钱。",
      "那孩子要是真急，别收她烘干费。写机器故障。"
    ],
    "intimate": [
      "开衫别高温，老料子经不起这么折腾。",
      "小闻，别把好心全写成赔偿单。"
    ]
  }
}
