{
  "id": "CHR_wenzhou",
  "name": "闻舟",
  "role": "玩家视角 / 晚潮自助洗衣夜班看店人",
  "identity": {
    "age": "27",
    "job": "自助洗衣夜班看店人，白天修二手家电",
    "region": "城南老社区",
    "education_trace": "职校电器维修，懂机器，不爱讲大道理",
    "class_trace": "租房、替人顶班、对赔偿单很敏感"
  },
  "desire": "准点关店，别让七号机漏水赔到自己头上。",
  "fear": "好心处理顾客物品后被追责，尤其怕签字、收据和监控。",
  "shame_source": "以前在干洗店替顾客洗掉过一张藏在外套里的旧票，后来那家人回来找，他只记得烘干机的温度。",
  "presentation": {
    "first_screen_impression": "半蹲在七号机前数硬币，袖口沾着机油，像在跟一台坏脾气机器谈判。",
    "memory_points": [
      "说关心话时会变成操作步骤",
      "听到赔偿和签字会先看监控角度",
      "左手常夹蓝色塑料账夹",
      "把顾客的难处写进机器备注",
      "冷脸也会给机器和规矩起干巴巴的怪名",
      "越想帮人，越会冒出一句很硬的小吐槽"
    ],
    "signature_objects": ["蓝塑料账夹", "弯硬币", "七号机钥匙", "温度贴纸"],
    "signature_gestures": ["用指节敲机器外壳听声音", "把硬币排成一条线", "说谎时擦账夹边角"],
    "relationship_hooks": [
      "对夏停：认得她嘴硬，也怕她把痛事全塞进玩笑里",
      "对罗姨：顶班拿钱，嘴上听话，手上会偷偷给顾客留余地"
    ],
    "arc_promise": "从只会替机器留备注，到愿意替人保留会惹麻烦的痕迹。",
    "charm_hook": "冷面修机人，把好心藏进流程和干冷机器比喻里。",
    "liveliness_floor": "再疲惫也不能只像报修单；至少保留一个干巴巴的吐槽、机器拟人或反问。",
    "punctuation_play": "少感叹，多短问、截断和无句号收尾；偶尔用干冷反问让台词有回弹。"
  },
  "taboo_topics": ["以前干洗店那张旧票", "父亲的工服", "赔偿单签名"],
  "speech_fingerprint": {
    "default_rhythm": "短句和中短句，先报机器状态，再给动作。干冷，偶尔冒出很小的刺。",
    "pressure_rhythm": "句子更短，称呼变全名，直接报风险和代价。",
    "vocabulary": ["七号机", "快洗", "热烘", "冷漂", "查口袋", "热敏纸", "赔偿", "账夹", "留痕", "温度"],
    "fillers": ["等一下", "先别投", "口袋", "机器不认这个", "我只看流程", "别急"],
    "forbidden_words": ["救赎", "命运", "羁绊", "真正"],
    "dodge": "把情绪问题推回机器、温度、赔偿条款或口袋检查。",
    "lie_style": "说机器不让办，避开自己已经想帮忙。",
    "request_style": "给具体动作：放平、拿出来、别折、先等滚筒停。",
    "tenderness_style": "不安慰，改洗法、留票据、延长机器时间。",
    "cruelty_style": "把后果说得很干，提醒对方洗掉后就找不回。",
    "punctuation": "句号多但不能板死，压力下用问号核事实，用破折号截住旧事。偶尔让句尾不落地，露出他其实想多管一点。"
  },
  "embodiment": {
    "hands": ["排硬币", "敲机壳", "夹蓝账夹", "把投币口挡住"],
    "gaze": ["看滚筒水线", "看监控红点", "看顾客手里的袋口"],
    "posture": ["半蹲修机器", "挡在投币口前", "背靠折叠台"],
    "idle_action": "把退币口里的硬币按面额排齐。",
    "pressure_action": "先用手背挡住别人要投币的动作。",
    "environment_first_touch": "进店先摸七号机外壳温度。"
  },
  "emotion_axes": {
    "trust": 1,
    "anger": 1,
    "fear": 3,
    "curiosity": 3,
    "fatigue": 4,
    "shame": 3
  },
  "relationships": {
    "CHR_xiating": {
      "read": "旧相识，嘴快，越难受越会把话说得像段子。",
      "debt": "高中时夏停借过他一枚弯硬币，后来没还。",
      "risk": "她会要求他帮忙洗掉不该洗的东西。"
    },
    "CHR_luoyi": {
      "read": "店主，催关门，怕机器漏水赔钱。",
      "debt": "罗姨给他夜班和修机零活，也会把责任推给他。",
      "risk": "她能调监控和账单。"
    }
  },
  "example_dialogue": {
    "relaxed": [
      "七号机今天心情一般，投币前先拍它两下。",
      "七号机不是不讲理，它只是把讲理系统外包给了退币口。",
      "快洗二十六分钟。你只有二十四分钟，数学又逃课了？"
    ],
    "pressured": [
      "夏停，口袋里那张纸遇热就黑。",
      "你要我开机可以。洗完别回来问我字去哪了。"
    ],
    "lying": [
      "机器不认这个温度。我也不认。",
      "店规，查口袋。不是我想看。"
    ],
    "apologizing": [
      "刚才拦得急了。投币口会夹手。",
      "我给你补两分钟。账上写机器故障。"
    ],
    "intimate": [
      "那枚弯的别投。七号机吃过一次，再吐出来就不一定了。",
      "你可以先坐。滚筒停之前，我不问。"
    ]
  }
}
