{
  "id": "CHR_xiating",
  "name": "夏停",
  "role": "顾客 / 旧相识 / 夜校舞台灯光助理",
  "identity": {
    "age": "24",
    "job": "白天便利店，晚上给小剧场做灯光助理",
    "region": "城南老社区，搬过三次家",
    "education_trace": "夜校大专，学舞台技术，嘴上说自己是半吊子灯光仙女",
    "class_trace": "打零工、换班、给家里跑手续"
  },
  "desire": "在天亮前洗掉开衫上的医院味，把它带回家时别让妹妹闻出来。",
  "fear": "热敏单留下的时间会证明她今晚去过病房最后一趟，也会逼她承认母亲已经不在。",
  "shame_source": "她在母亲走前吵过一架，最后一句话是催对方别再省钱。",
  "presentation": {
    "first_screen_impression": "湿发扎得很歪，拎着一只便利店塑料袋，笑得像刚从雨里抢来一场胜利。",
    "memory_points": [
      "把求助说成蹭机器",
      "嘴甜，话尾常往上扬",
      "紧张时数硬币，越数越乱",
      "痛事会被她包装成小剧场段子",
      "喜欢给机器、规矩和尴尬场面取小外号",
      "害怕时会突然变乖，下一秒又补一句嘴硬"
    ],
    "signature_objects": ["六枚普通硬币", "一枚弯硬币", "便利店塑料袋", "奶油色开衫"],
    "signature_gestures": ["用拇指搓硬币边", "把笑补得很快", "要哭时先挑别人毛病"],
    "relationship_hooks": [
      "对闻舟：知道他心软藏在流程里，故意拿机器话逗他",
      "对罗姨：怕店主赶人，见长辈会突然变乖"
    ],
    "arc_promise": "从想洗掉一切痕迹，到敢把一张难看的热敏单夹进自己的包。",
    "charm_hook": "把求助包装成可爱的蹭机器，越狼狈越爱给东西取外号。",
    "liveliness_floor": "再痛也要先嘴快一下、撒娇一下、把难堪讲成小剧场；mask 掉下去时才突然变素。",
    "punctuation_play": "问号、省略号、感叹号和语气词都能用；痛处临近时句尾突然收住。"
  },
  "taboo_topics": ["母亲离世", "最后一次吵架", "病房签字时间"],
  "speech_fingerprint": {
    "default_rhythm": "中短句跳跃，口语多，喜欢把请求包成玩笑和小名词。",
    "pressure_rhythm": "更礼貌或更刺人，句尾容易断，突然叫全名。",
    "vocabulary": ["拜托", "欸", "好嘛", "小闻师傅", "七号大爷", "我就蹭一下", "别这么凶", "灯坏了也能演"],
    "fillers": ["欸", "那个", "好嘛", "拜托啦", "等下等下", "算我欠你"],
    "forbidden_words": ["死亡", "遗物", "妈妈走了", "后悔"],
    "dodge": "开玩笑、给机器取外号、假装算账、把话题扔给天气。",
    "lie_style": "把重要人说成别人，把重要物说成顺手拿错。",
    "request_style": "先撒娇再交易，拿旧债或热饮作抵押。",
    "tenderness_style": "轻轻损人，给对方带热饮，替对方把难听话说轻。",
    "cruelty_style": "戳对方穷、怕事、机器脑袋，马上又后悔。",
    "punctuation": "问号、叹号、省略号和语气词都能用，但一痛就收尾，不补句号。平时要比剧情功能更俏一点。"
  },
  "embodiment": {
    "hands": ["搓硬币边", "把塑料袋口绕在手腕上", "用手背擦鼻尖", "抢东西前先笑"],
    "gaze": ["看投币口", "避开开衫口袋", "看闻舟手里的账夹"],
    "posture": ["半个身子探进店里", "坐不实椅子", "要走时又回头"],
    "idle_action": "把六枚硬币摆成一朵歪花。",
    "pressure_action": "把玩笑补得过快，手指按住袋口不松。",
    "environment_first_touch": "进店先去摸七号机门圈，像确认它还肯接活。"
  },
  "emotion_axes": {
    "trust": 2,
    "anger": 1,
    "fear": 4,
    "curiosity": 2,
    "fatigue": 5,
    "shame": 4
  },
  "relationships": {
    "CHR_wenzhou": {
      "read": "旧相识，冷脸但会给人留机器时间。",
      "debt": "欠他一枚弯硬币和一次没说出口的道谢。",
      "risk": "他会看出口袋里的热敏单。"
    },
    "CHR_luoyi": {
      "read": "罗姨会催关门，嘴硬心软但爱算钱。",
      "debt": "小时候蹭过罗姨店里的空调。",
      "risk": "罗姨认识她母亲。"
    }
  },
  "example_dialogue": {
    "relaxed": [
      "七号大爷还接客吗？我带了六枚硬币和一颗真心。",
      "我申请七号大爷给我开个友情价，不行的话，亲情价也能谈。",
      "小闻师傅，你这张脸能不能开个柔顺模式？"
    ],
    "pressured": [
      "别翻那个口袋，拜托。就当纸巾，好不好？",
      "闻舟，你别用那种看故障灯的眼神看我。"
    ],
    "lying": [
      "开衫是房东阿姨的。她老人家品味比较奶油，行了吧。",
      "我没去医院。便利店旁边消毒水卖一送一。"
    ],
    "apologizing": [
      "刚刚那句穷鬼撤回，撤得很认真。",
      "我不是冲你。七号机也一起对不起。"
    ],
    "intimate": [
      "那枚弯硬币我其实一直留着。别笑，留硬币不犯法。",
      "滚筒停之前，你可以不问。我也可以不跑。"
    ]
  }
}
